{
  "version": "2.0",
  "source": "Arma Reforger Official Data",
  "lastUpdated": "2026-04-16T08:26:05.303Z",
  "weaponSystems": [
    {
      "id": "2B14",
      "name": "Soviet 2B14 82mm Mortar",
      "caliber": 82,
      "milSystem": {
        "name": "Warsaw Pact",
        "milsPerCircle": 6000,
        "milsPerDegree": 16.6667
      },
      "shellTypes": [
        {
          "type": "HE",
          "name": "O-832 HE",
          "charges": [
            {
              "level": 0,
              "minRange": 50,
              "maxRange": 500,
              "rangeTable": [
                {
                  "range": 50,
                  "elevation": 1455,
                  "tof": 15.0,
                  "dElev": 44,
                  "tofPer100m": 0.0
                },
                {
                  "range": 100,
                  "elevation": 1411,
                  "tof": 15.0,
                  "dElev": 46,
                  "tofPer100m": 0.1
                },
                {
                  "range": 150,
                  "elevation": 1365,
                  "tof": 14.9,
                  "dElev": 47,
                  "tofPer100m": 0.1
                },
                {
                  "range": 200,
                  "elevation": 1318,
                  "tof": 14.8,
                  "dElev": 50,
                  "tofPer100m": 0.2
                },
                {
                  "range": 250,
                  "elevation": 1268,
                  "tof": 14.6,
                  "dElev": 51,
                  "tofPer100m": 0.2
                },
                {
                  "range": 300,
                  "elevation": 1217,
                  "tof": 14.4,
                  "dElev": 58,
                  "tofPer100m": 0.3
                },
                {
                  "range": 350,
                  "elevation": 1159,
                  "tof": 14.1,
                  "dElev": 64,
                  "tofPer100m": 0.4
                },
                {
                  "range": 400,
                  "elevation": 1095,
                  "tof": 13.7,
                  "dElev": 72,
                  "tofPer100m": 0.5
                },
                {
                  "range": 450,
                  "elevation": 1023,
                  "tof": 13.2,
                  "dElev": 101,
                  "tofPer100m": 0.8
                },
                {
                  "range": 500,
                  "elevation": 922,
                  "tof": 12.4,
                  "dElev": 0,
                  "tofPer100m": 0.0
                }
              ]
            },
            {
              "level": 1,
              "minRange": 100,
              "maxRange": 800,
              "rangeTable": [
                {
                  "range": 100,
                  "elevation": 1446,
                  "tof": 19.5,
                  "dElev": 27,
                  "tofPer100m": 0.1
                },
                {
                  "range": 200,
                  "elevation": 1392,
                  "tof": 19.4,
                  "dElev": 28,
                  "tofPer100m": 0.1
                },
                {
                  "range": 300,
                  "elevation": 1335,
                  "tof": 19.2,
                  "dElev": 29,
                  "tofPer100m": 0.1
                },
                {
                  "range": 400,
                  "elevation": 1275,
                  "tof": 18.9,
                  "dElev": 31,
                  "tofPer100m": 0.1
                },
                {
                  "range": 500,
                  "elevation": 1212,
                  "tof": 18.6,
                  "dElev": 35,
                  "tofPer100m": 0.2
                },
                {
                  "range": 600,
                  "elevation": 1141,
                  "tof": 18.1,
                  "dElev": 40,
                  "tofPer100m": 0.3
                },
                {
                  "range": 700,
                  "elevation": 1058,
                  "tof": 17.4,
                  "dElev": 48,
                  "tofPer100m": 0.4
                },
                {
                  "range": 800,
                  "elevation": 952,
                  "tof": 16.4,
                  "dElev": 81,
                  "tofPer100m": 0.9
                }
              ]
            },
            {
              "level": 2,
              "minRange": 200,
              "maxRange": 1400,
              "rangeTable": [
                {
                  "range": 200,
                  "elevation": 1432,
                  "tof": 24.8,
                  "dElev": 17,
                  "tofPer100m": 0.0
                },
                {
                  "range": 300,
                  "elevation": 1397,
                  "tof": 24.7,
                  "dElev": 18,
                  "tofPer100m": 0.0
                },
                {
                  "range": 400,
                  "elevation": 1362,
                  "tof": 24.6,
                  "dElev": 18,
                  "tofPer100m": 0.1
                },
                {
                  "range": 500,
                  "elevation": 1325,
                  "tof": 24.4,
                  "dElev": 18,
                  "tofPer100m": 0.1
                },
                {
                  "range": 600,
                  "elevation": 1288,
                  "tof": 24.2,
                  "dElev": 20,
                  "tofPer100m": 0.1
                },
                {
                  "range": 700,
                  "elevation": 1248,
                  "tof": 24.0,
                  "dElev": 20,
                  "tofPer100m": 0.1
                },
                {
                  "range": 800,
                  "elevation": 1207,
                  "tof": 23.7,
                  "dElev": 22,
                  "tofPer100m": 0.2
                },
                {
                  "range": 900,
                  "elevation": 1162,
                  "tof": 23.3,
                  "dElev": 23,
                  "tofPer100m": 0.2
                },
                {
                  "range": 1000,
                  "elevation": 1114,
                  "tof": 22.9,
                  "dElev": 26,
                  "tofPer100m": 0.3
                },
                {
                  "range": 1100,
                  "elevation": 1060,
                  "tof": 22.3,
                  "dElev": 29,
                  "tofPer100m": 0.3
                },
                {
                  "range": 1200,
                  "elevation": 997,
                  "tof": 21.5,
                  "dElev": 37,
                  "tofPer100m": 0.4
                },
                {
                  "range": 1300,
                  "elevation": 914,
                  "tof": 20.4,
                  "dElev": 55,
                  "tofPer100m": 0.8
                },
                {
                  "range": 1400,
                  "elevation": 755,
                  "tof": 17.8,
                  "dElev": 0,
                  "tofPer100m": 0.0
                }
              ]
            },
            {
              "level": 3,
              "minRange": 300,
              "maxRange": 1800,
              "rangeTable": [
                {
                  "range": 300,
                  "elevation": 1423,
                  "tof": 28.9,
                  "dElev": 13,
                  "tofPer100m": 0.0
                },
                {
                  "range": 400,
                  "elevation": 1397,
                  "tof": 28.8,
                  "dElev": 14,
                  "tofPer100m": 0.1
                },
                {
                  "range": 500,
                  "elevation": 1370,
                  "tof": 28.6,
                  "dElev": 13,
                  "tofPer100m": 0.1
                },
                {
                  "range": 600,
                  "elevation": 1343,
                  "tof": 28.5,
                  "dElev": 14,
                  "tofPer100m": 0.0
                },
                {
                  "range": 700,
                  "elevation": 1315,
                  "tof": 28.5,
                  "dElev": 14,
                  "tofPer100m": 0.1
                },
                {
                  "range": 800,
                  "elevation": 1286,
                  "tof": 28.3,
                  "dElev": 14,
                  "tofPer100m": 0.1
                },
                {
                  "range": 900,
                  "elevation": 1257,
                  "tof": 28.1,
                  "dElev": 16,
                  "tofPer100m": 0.1
                },
                {
                  "range": 1000,
                  "elevation": 1226,
                  "tof": 27.9,
                  "dElev": 16,
                  "tofPer100m": 0.2
                },
                {
                  "range": 1100,
                  "elevation": 1193,
                  "tof": 27.6,
                  "dElev": 16,
                  "tofPer100m": 0.2
                },
                {
                  "range": 1200,
                  "elevation": 1159,
                  "tof": 27.2,
                  "dElev": 18,
                  "tofPer100m": 0.2
                },
                {
                  "range": 1300,
                  "elevation": 1123,
                  "tof": 26.8,
                  "dElev": 19,
                  "tofPer100m": 0.2
                },
                {
                  "range": 1400,
                  "elevation": 1084,
                  "tof": 26.4,
                  "dElev": 22,
                  "tofPer100m": 0.3
                },
                {
                  "range": 1500,
                  "elevation": 1040,
                  "tof": 25.8,
                  "dElev": 24,